{
  "$schema": "https://json-schema.org/draft/2020-12/schema",
  "$id": "https://survey-system.local/json-schema/survey_versions.schema.json",
  "title": "survey_versions collection document",
  "description": "Immutable-after-publication content snapshot. Each publication gets a new version document; responses pin this _id. Draft versions may be updated in place while state=draft. Semantic invariants (checked at publish): question_ids and option_ids are unique; every jump condition references the current or an earlier question; every goto target is a later question; operators and constraint values match the source question type; no exact/min/max conflict; version_no is unique per survey. A published document is never edited again.",
  "type": "object",
  "additionalProperties": false,
  "properties": {
    "_id": {
      "$ref": "common.schema.json#/$defs/ObjectId"
    },
    "schema_version": {
      "$ref": "common.schema.json#/$defs/SchemaVersion"
    },
    "survey_id": {
      "$ref": "common.schema.json#/$defs/ObjectId"
    },
    "version_no": {
      "type": "integer",
      "minimum": 1
    },
    "state": {
      "enum": [
        "draft",
        "published"
      ]
    },
    "content_schema_version": {
      "type": "integer",
      "enum": [
        1,
        2
      ],
      "description": "Version of the question/logic DSL. Version 2 adds the optional question_ref on embedded questions; version 1 documents keep their old value."
    },
    "revision": {
      "type": "integer",
      "minimum": 1,
      "description": "Optimistic-lock counter used while the version is still a draft."
    },
    "questions": {
      "type": "array",
      "minItems": 1,
      "maxItems": 300,
      "items": {
        "$ref": "common.schema.json#/$defs/Question"
      },
      "description": "Frozen question snapshots. Each question may additionally carry an optional question_ref = { entity_id, version_id } pointing at its shared library identity; the full inline content remains the source for rendering, validation and single-survey statistics, and must hash-match the referenced question_versions document."
    },
    "created_by": {
      "$ref": "common.schema.json#/$defs/ObjectId"
    },
    "created_at": {
      "$ref": "common.schema.json#/$defs/UtcDateTime"
    },
    "updated_at": {
      "$ref": "common.schema.json#/$defs/UtcDateTime"
    },
    "published_at": {
      "oneOf": [
        {
          "$ref": "common.schema.json#/$defs/UtcDateTime"
        },
        {
          "type": "null"
        }
      ]
    },
    "content_hash": {
      "oneOf": [
        {
          "$ref": "common.schema.json#/$defs/ContentHash"
        },
        {
          "type": "null"
        }
      ],
      "description": "SHA-256 over canonical JSON of questions. Used for audit and duplicate-publish detection."
    }
  },
  "required": [
    "_id",
    "schema_version",
    "survey_id",
    "version_no",
    "state",
    "content_schema_version",
    "revision",
    "questions",
    "created_by",
    "created_at",
    "updated_at",
    "published_at",
    "content_hash"
  ]
}
